reviewId,userName,userImage,content,score,thumbsUpCount,reviewCreatedVersion,at,replyContent,repliedAt
5dd4343a-5f08-4e71-9e0a-02849ad1c805,Sarah Wright,https://play-lh.googleusercontent.com/a-/ACNPEu-gvMynBVvCqr8WogmXF2ywlktJwBg7J0OuTCfk,"Downloaded the app after a friend sent me a link to a trail we're considering. Perhaps I am doing something wrong in the app navigation, but once I choose a trail from the trail list I cannot figure out how to get back to the list. I like to find new trails and review options before heading out for the day. I have to close and reopen after I read about every trail. Really annoying. Also, the search feature doesn't have the ability to sort by distance, difficulty, etc. Pointless. Deleting.",2,35,3.10.0,2020-05-17 18:58:03,,
c0e08206-2b6a-451f-8a46-677050f169c2,A Google user,https://play-lh.googleusercontent.com/EGemoI2NTXmTsBVtJqk8jxF9rh8ApRWfsIMQSt2uE4OcpQqbFu7f7NbTK05lx80nuSijCz7sc3a277R67g,"This app could be SO much better. Unlike on the website, there is no ability to filter trails. In addition, there is no ""legend"" so you are left to decide if something is a hiking trail or a ski run. There is no ability to select trail segments & add them together to construct a different route with ascent/descent/length, etc. I like how snappy the map painting is. I'm hard pressed to think what else I like. I'm hoping this improves A LOT before I need it. For now, I've got multiple apps.",3,15,3.5.2,2019-11-15 21:46:01,,
0aa51b9e-75b6-4872-a58a-0d2d9ea73a7b,A Google user,https://play-lh.googleusercontent.com/EGemoI2NTXmTsBVtJqk8jxF9rh8ApRWfsIMQSt2uE4OcpQqbFu7f7NbTK05lx80nuSijCz7sc3a277R67g,"This app is good because it has features such as offline maps that are usually found only in the premium version of other similar apps. But it lacks a few features that will make it much better. First, the search function is very poor. It is difficult to gwt what you are looking for, and some trails seem to be entirely missing from this app. Second, the app forces you to download a region offline before you can do anything. Also should implement directions to trailheads.",3,9,3.4.0,2019-07-30 00:26:34,"Hi Balaji, thanks for your feedback.  We're working on improving search over the next few weeks!  Also, directions are available on the trail screen with the Driving Directions button.  Our app is a community resource with data contributed by users.  We encourage everyone to upload tracks, descriptions, and photos at https://www.hikingproject.com.",2019-08-09 22:09:21
308c1dd9-542d-4a64-9cb7-5cdb8844d54e,A Google user,https://play-lh.googleusercontent.com/EGemoI2NTXmTsBVtJqk8jxF9rh8ApRWfsIMQSt2uE4OcpQqbFu7f7NbTK05lx80nuSijCz7sc3a277R67g,"(1) I can't review saved hikes. In particular, the map overlay of my route is unavailable on review. What's the point of saving it if I can't review where I was? (2) The app lacks internal consistency for distance hiked. I hiked a path for the first and only time and it was recorded as 7.9 miles in one part of the app and 8.2 miles in another. This is for the ONE AND ONLY journey I made on this route, so it's not possible to be reporting for two different journeys with different distances. (3) Wayfinding is made easier real-time when I think I have lost the trail. It has been helpful for this.",2,6,3.10.0,2020-04-24 13:52:17,,
159fc69a-e497-477f-b5f2-37423bbcafd2,Tonya Clark,https://play-lh.googleusercontent.com/a/ALm5wu1qgPK1pBykBOtSvDDD-nVtJjsVpRQy451T2cFd=mo,"I really like the web version but the Android app has a long way to go. When I search for a particular trail that is highlighted and recommended on the web version, it shows in the results but not on the navigation map. In fact many trails are not showing up on the map. Western North Carolina looks like it has nothing to hike. Unless I am using the app incorrectly, this version is unusable at this time for my location",1,6,3.11.0,2020-07-23 10:43:07,,
71ad0e2c-f46d-4cd4-941f-f650eb0ba92c,Crystal Arriaga,https://play-lh.googleusercontent.com/a/ALm5wu1rj3wZ0FPiePw0pEi1cJ2mpZ-hq2CC2XW-8QkE=mo,"This has been the best hiking app I can find. But sometimes I can't always find the trails I am looking for on this app, and I have to use a different app. Some of these trail reviews are stupid. ""There were mosquitos,"" ""it was muddy."" Well, you are outside..duh. Also, it would be nice to have a feature where I can create my own route, especially where many trail systems converge.",4,13,3.13.1,2021-02-03 19:30:25,,
accc2614-ae93-4378-b746-e04fb045fe77,A Google user,https://play-lh.googleusercontent.com/EGemoI2NTXmTsBVtJqk8jxF9rh8ApRWfsIMQSt2uE4OcpQqbFu7f7NbTK05lx80nuSijCz7sc3a277R67g,"This app is great! My only complaint is regarding the photo carousel. Its extremely annoying to look through photos of various trails because the carousel is on a timer, but when I try to manually flip through photos the carousel timer goes off and flips to the next photo. It happens very often and I sometimes spend 5 or more seconds trying to land on the correct photo. Hence, the 3 star rating.",3,5,3.3.1,2019-06-30 23:10:28,,
b2296bfd-6574-4e98-989f-e29287d3a779,"Luke “蘇, 覽萪” Cunningham",https://play-lh.googleusercontent.com/a-/ACNPEu8H7ULBO6YYJvfYj9hAEDg5_Q6k0iu_YxHSKsEDfQ,Great app. Is only really missing one big thing that I think would perfect it. They need to add the function/ability to plan ahead on your hike! There's a ton of trails that join others and continue on that I would love to be able to plan a trip on but the app doesn't make me able to do that. Would be very nice to be able to trace out a map/trail of where I plan to or would like to hike.,4,15,3.11.0,2020-05-26 01:33:17,,
83d51c70-80b7-49d2-80e8-2f55110f30d5,Chantell Gregory,https://play-lh.googleusercontent.com/a/ALm5wu0b5BvrikdBad4Qn-mXuYlBnDBZLqRG7alG4uPf=mo,"I love that I don't have to download an area before going, that it works offline. I wish it had more trails, especially ones that are well marked and noted at the trailhead. My FAV hiking app! And love that I can see where I am on the map, and if I got off trail. And the altitude mapping (peaks and valleys) is very handy, especially figuring out how difficult a trail is",5,26,21.14.0,2022-02-12 16:53:19,,
76ed3217-4648-41fa-a69b-4fa26c109837,Joe Hufford,https://play-lh.googleusercontent.com/a-/ACNPEu-k7KMz82qMpUT7PXZE3Pus61-xXXAADypgN3cb,"It does not properly download the maps. So if you're going to use it, make sure you zoom in on the entire area you're going to be in, with both topo and sat maps *while you still have internet* so they're cached. This is unacceptable since it claims to have downloaded the maps. Also if you accidentally hit finish on a hike recording, you can't back out and continue recording. So the UI needs some work too.",1,22,21.14.0,2021-07-12 06:37:41,,
3cdeadaa-02d6-4245-b50b-d5999445ea87,Alex Gray,https://play-lh.googleusercontent.com/a-/ACNPEu8WHplKqT9Eb0ZGHzfABSZ4K26NXRRm59b8uMpuuQ,"The app looks nice, but I found it hard to navigate. More importantly, it is missing the most important feature any hiking/backpacking app absolutely NEEDS: the ability to filter trails based on location, length, difficulty, type, etc. Without filtering, this app is useless to me as a backpacker. There are way too many trails to rummage through manually without knowing if I can backpack on them.",2,22,3.11.0,2020-06-02 18:11:54,,
ca9d56f5-81e9-4d32-83ea-a5b1063ce78d,Hike with Oats,https://play-lh.googleusercontent.com/a-/ACNPEu_bwmh6Fp58n-NurzVKy9X0i8QjHmqLgnFCRfJaOCE,"I hate the new update. I loved this app because I could get accurate information about the inclines at any point of the hike. Now it's super jumpy and not user friendly at all. The range of what the color red represents is way to large. Please bring back the option to pick precise locations on a trail to see the incline or add new colors for steep inclines. Having red represent anything over 15% makes it hard to tell what im really in for, a 50% incline is extremely harder than 15%.",2,12,3.12.1,2020-09-16 18:19:02,,
f8bced59-af3c-43df-9120-8d98f076b81c,Keith Connor,https://play-lh.googleusercontent.com/a-/ACNPEu-Vs3GUXpNA2xeM7x_cd7QsWo8YGcAw51ecozYX8Q,"Great idea, but needs more work. My biggest complaint: when recording it constantly zooms back out so that the WHOLE recording is on screen even when I've zoomed in so I can see the detail of the area where I am at the moment. Also sometimes it pegs my location miles away (I think possibly from a cell tower ping) and I can't find a way to edit or remove the point from the recording.",3,3,3.11.0,2020-09-07 20:58:50,,
c712c324-c349-49fc-9b94-9ffc137b1366,Krystian Glowacz,https://play-lh.googleusercontent.com/a-/ACNPEu-hZ-NKpC-Qv1buXGIk-CnXaOGQsKK2jESiDhfKMQ,"Just downloaded the app and so far its easy to use, good UI, and high quality content. Immediate ""issue"" that I think would skyrocket this app into a 5 or 6 star rating is a filter option when searching for trails. Being able to filter distance, altitude change, difficulty, and even star ratings by users would be such a quick and easy way to significantly improve the app.",4,28,22.10.0,2022-05-17 14:41:20,,
95b0a88c-e45c-4ebb-9362-b6ec6babe6ab,Tanaya Mankad,https://play-lh.googleusercontent.com/a-/ACNPEu8AHdwfECZZBaenJoIuMKu2A3-RLvscFcKgaNkaag,"How does this app average such a high score? The back button has random behavior and you can't use it to exit the app at all. Each trail may or may not have all the listing elements (elevation, etc) - not even placeholders. Driving directions sometimes take you to the end of the trail instead of the trailhead. And the last trail I hiked is permanently pinned to every page I go to.",2,9,3.13.1,2020-12-27 23:14:06,,
367f1a22-81f1-4561-a01d-67aa41672575,Blake Golber,https://play-lh.googleusercontent.com/a/ALm5wu299oqNrYqgPvpF1ta_LYTjMuq5KBa8nlNrBJOjO_g=mo,"The Hiking Project changed the way I hike. It's extremely straightforward, uncluttered and intuitive unlike other hiking apps I've tried. When you open the app a topographical map pops up with your current location in conjunction with the trails around unlike other apps that bloat the screen with a description of the trail and what others think about it before displaying it's location in a remotely understandable fashion. I love this app. Thank you to the developers and crowdfunders.",5,24,21.14.0,2021-05-24 18:36:23,,
2affac11-d77b-471e-95b8-cfcef15742a0,A Google user,https://play-lh.googleusercontent.com/EGemoI2NTXmTsBVtJqk8jxF9rh8ApRWfsIMQSt2uE4OcpQqbFu7f7NbTK05lx80nuSijCz7sc3a277R67g,Really cool app. My favorite feature is that you can download the trail map and still use it offline while still being located on the map with real ACCURACY. I reccomend this for avid hikers and even people just going for a walk in the woods. I've used this in Yellowstone as well as back in Indiana for those parks that don't always have the best paper maps available.,4,18,3.4.0,2019-09-30 13:17:38,,
79c9944b-e9a7-4fd3-9dd3-e82509a686ec,Jim A,https://play-lh.googleusercontent.com/a/ALm5wu3Vgx8wS22eq2UZNr8v9CKo6pRUVbE-_jxFbH_T=mo,"Offline maps work, records where you've been, keeps a log of recorded hikes. Web app is easier to use, on phone or PC. Favorites list helps remember hikes to do again. No route planning using multiple trails. Needs some bug fixes, new features, but apparently no longer being actively maintained.",3,20,22.10.0,2022-05-23 03:50:14,,
399690b8-0115-4024-a21a-983478395e06,A Google user,https://play-lh.googleusercontent.com/EGemoI2NTXmTsBVtJqk8jxF9rh8ApRWfsIMQSt2uE4OcpQqbFu7f7NbTK05lx80nuSijCz7sc3a277R67g,"Recently hiked a 7.5 mile loop in the Ozark National Forest along the Buffalo River in Arkansas. Did a trail with about a 1400 ft elevation change and made several river crossings. This app, on airplane mode and no wifi, kept us on the trail using our gps location. Many trail junctions were overgrown and undetectable with the human eye but the app kept us on trail regardless. For a free app, this think was awesome! Saved us hours of backtracking and the possibility of getting lost.",5,19,3.2.8,2019-06-01 09:50:30,,
e437b096-6f12-4c35-bad7-60eb4eaad995,A Google user,https://play-lh.googleusercontent.com/EGemoI2NTXmTsBVtJqk8jxF9rh8ApRWfsIMQSt2uE4OcpQqbFu7f7NbTK05lx80nuSijCz7sc3a277R67g,"I am an avid hiker, & what seemed like a very promising app just would not work. You cannot check into a trail without signing up or logging in, & I can't do either because of a constant message about rough weather due to their servers being 'temporarily' down (this occurring over a period of several days). A shame, as I heard great things about this app & was really looking forward to using it. Uninstalling & moving on.",1,5,,2019-11-24 17:20:33,"Thanks for your feedback on Hiking Project.  We didn't have any scheduled downtime or other reported issues during that timeframe, and the logs look normal, but we'll watch for more info.  FYI, you don't need an account for most of the features, such as viewing maps, trails, photos, conditions, or comments.",2019-12-12 22:45:39
1a3c0790-a084-4a30-b583-743b0fdc2e30,A Google user,https://play-lh.googleusercontent.com/EGemoI2NTXmTsBVtJqk8jxF9rh8ApRWfsIMQSt2uE4OcpQqbFu7f7NbTK05lx80nuSijCz7sc3a277R67g,"This app has so much potential and in some ways breasts most other apps for features, but the trail maps are terrible for my state anyway. At least 50 percent of the trails are missing, even the national Forest trails for much of the state are missing. Even national trails are missing. It would also be nice if they added land ownership like Trailforks. The only reason I give the app 3 stars is it generally works with showing topography on maps when you are offline when many apps will not.",3,3,3.5.0,2019-11-10 06:55:00,,
a3f6b3a6-9049-4b5d-8c2e-74856699e3aa,Eryn Cangi,https://play-lh.googleusercontent.com/a/ALm5wu2h-d8Ra_FtlZEy_zQHG-AhFSOaaPO3dBQKu3V6=mo,"It's a good app, but I miss the feature where we used to be able to add trails to a to-do list. Also it would be super helpful if there could be a comment section for details on conditions and other stuff like there is on Mountain project. Also seems to be missing some trails compared to AllTrails (e.g.)",4,0,,2020-05-21 19:17:41,,
5607db4c-3085-47e6-868e-547a1af5d48d,A Google user,https://play-lh.googleusercontent.com/EGemoI2NTXmTsBVtJqk8jxF9rh8ApRWfsIMQSt2uE4OcpQqbFu7f7NbTK05lx80nuSijCz7sc3a277R67g,"Needs improvement. Cannot add photos or review trails in app. Only post conditions. Also missing many significant trail systems. For example, Wayne National Forest has no trails listed in this app. I realize this is all user input but it would be nice if you could track and add trail routes such as in the AllTrails app. Hiking Project is the easiest app to use though and I utilized it when hiking in Colorado in addition to other apps and maps. Same for the REI bike trail app. Missing huge trails",4,0,3.2.8,2019-05-27 19:17:40,,
b54ff778-b220-46f4-96e1-74d771861a65,Eric Hammond,https://play-lh.googleusercontent.com/a/ALm5wu3RtBmG2s7NXCQflEMV0t0bWN9whM-wxZJttrkc=mo,"Good resource for trails, but several flaws that make it much less useful than it could be. If not recording a hike, you can follow position along a known trail quite accurately When recording a hike the ability to see where you are disappears... VERY INCONVENIENT. App also seems to rely on cell tower triangulation for positioning. When the app loses a cell tower, it loses position and then goes haywire. It has 'tracked"" 11-12 miles on several recentt 3 mi hikes.",2,13,3.12.2,2020-10-06 01:36:32,,
445066f2-dbed-44f9-b0ef-442b0516481a,Sue C,https://play-lh.googleusercontent.com/a-/ACNPEu89-wlUBMkhemYhkfEyGEGjvPQVjt3f3JiF0JqcHg,"Screen navigation terrible - first time I use it maps don't look too bad even though descriptions aren't so great, so I choose a trail - and there's no way to get back to the main list of trails. Go to the help page (web link) and there's even an FAQ asking how do I get back to the main list of trails. Not a good sign. It says click the icon in the upper left - but there is no icon on the upper left! Using Android on Samsung Galaxy 8 plus.",3,4,3.11.0,2020-08-15 10:48:15,,
1a42ae29-5989-4294-b53a-6e01403f3e20,greg olsen,https://play-lh.googleusercontent.com/a/ALm5wu3mXcTVmjzhCQLJ3Gype1nUqSgz0W79vh3PbNcd=mo,"This is my navigation app of choice when I'm out backpacking (to supplement paper maps of course). The trails included are very comprehensive, though many remote or unmarked trails are not mapped here. I sometimes have problems moving the map around/zooming, and scrolling along the elevation profile feature is a bit buggy, but otherwise this is pretty great.",5,0,,2021-06-30 00:41:02,,
a03686e8-473c-4b37-8283-5ebfc0c4cf0b,Desi Marble,https://play-lh.googleusercontent.com/a/ALm5wu047qMfdmk4LXknWD2f9vOmnRKypfwtbN_TP57sfQ=mo,"I started using the app July 2020. Once I figured it out, it did well tracking/recording my hikes. Since December 2020 it has performed horribly. Zero accuracy. I tried uninstalling and reinstalling. No improvement. I have waited beyond the 2 week Friday updates. No change to correct tracked routes. Cannot rely on this app for recording tracks to refer to at a later date. Wish I could add a photo of my last 'wild' tracks. Would explain well what I am trying to describe.",1,7,3.13.1,2021-02-02 01:26:04,,
63a76022-c76c-48cb-94f5-fe6a4f967153,Josh Miller,https://play-lh.googleusercontent.com/a-/ACNPEu9QOQXBT4TsIK7JJJTs-VcKkTW7sIL6tLtUJ2KiIXM,"I do love this app, and the MTN bike project one as well!! Super simple, but has pretty much all the trails I use, which is all I need. The only thing I would really like to have as an option, is for users to submit campsite locations. I have a trail in GA that I like to overnight backpack, but using these maps, I have no idea where all the campsites are.",4,4,3.12.2,2020-11-28 13:23:09,,
0a0e83b3-416d-4280-9654-67d1324beeb7,Phil Shannon,https://play-lh.googleusercontent.com/a-/ACNPEu_uPZksMHDDCnRBaJZs0kH2IeA5NzIgnqQYE0NwtM8,Maps are easily downloaded for offline viewing. It's cool to see your progress mapped on both the map and the elevation graph. I wish there was more customization in defining a trail before you actually record it - I'd like to define a trail on the map and then go hike it.,4,9,21.14.0,2021-06-08 00:49:33,,
e6d608de-aa34-4968-bc21-97ffe2177a8b,A Google user,https://play-lh.googleusercontent.com/EGemoI2NTXmTsBVtJqk8jxF9rh8ApRWfsIMQSt2uE4OcpQqbFu7f7NbTK05lx80nuSijCz7sc3a277R67g,"I want to really like this app, but unless I'm missing something, to check in to a hike you have to finish the hike then report the distance hiked. In an area with multiple intersecting trails, if I make my own loop out of 4 of them I have no way of recording this or checking in because my milage will be way different from the trail I started at. It's too bad you can't ""start"" a hike and have it follow your hike and at the end record your hike. It should use GPS to track distance automatically.",3,22,3.2.8,2019-02-23 23:19:42,,
148c2ed1-8634-42c7-8dd7-a41049230f6f,A Google user,https://play-lh.googleusercontent.com/EGemoI2NTXmTsBVtJqk8jxF9rh8ApRWfsIMQSt2uE4OcpQqbFu7f7NbTK05lx80nuSijCz7sc3a277R67g,This app is really nice. It has a nice listing of trails with information and photos. The trail info can be downloaded and used offline which is important since trails tend to be in the middle of the woods with no reception. Finding trails in the local area is easy. I can bring up the map and list all the short hikes nearby. This app will be staying on my phone.,5,7,3.2.8,2019-05-30 14:35:45,,
09dd26bb-e97b-4133-abe0-56d5b7c72d4e,DA Porter,https://play-lh.googleusercontent.com/a-/ACNPEu_p-TeIwxbwAL_6OR616y6jWu3icdshfhHAYcFe,"Offline hiking maps, GPS, free; excellent! I installed this app after realizing the ""free"" version of a popular hiking app would be completely unusable for my weeklong hiking trip in the North Cascades. Hiking Project was essential for planning hikes and checking out elevations and trail steepness.",5,0,22.10.0,2022-09-17 16:44:58,,
093125a7-9810-4acc-8218-3a0258a55dbc,Scott Ross,https://play-lh.googleusercontent.com/a-/ACNPEu9uX72YPiMKGk4AsW6FAKcfA6GsEeaftPOHPiiu9EI,"The interface is really great and there are lots of trails, even some that don't show up on all trails. The recording function does use a lot of power, and I would like to see a better way to tell how much of the distance and elevation I have hiked and are left.",4,0,22.10.0,2022-10-16 10:04:15,,
526be197-ac6e-48cb-bdcd-c1b06993d6be,R. Chris Owen,https://play-lh.googleusercontent.com/a-/ACNPEu9RGyY7jbLn9sEfYXcQKElEoytk2WDOQpPTcaPZ,"Doesn't work offline. Like, it's about going on trails where there may be no cell coverage, but despite downloading areas ahead of time, the app doesn't know where I am on the planet. Why doesn't gps location work? So useless.",1,0,22.10.0,2022-10-02 04:21:58,,
d268d423-4070-42ce-8d78-920e378b1479,Kate Theriault,https://play-lh.googleusercontent.com/a/ALm5wu2CeXrRzhUsgxQTzhnc4JGagTjiCpyke3BY3yI0=mo,"Doesn't properly record hikes, keeps recording me several miles from where I started randomly throughout the hike. Can't display the map of the trail I want to be following while using record....that's the entire point of these type of apps. Much of the trail info in Montana is not correct, but no way to contribute on the app. Pretty disappointed, but two stars because it has more trails mapped in Montana than AllTrails.",2,8,3.13.1,2021-03-18 04:00:52,,
0166d707-370e-45a0-9dac-ca8846657179,A Google user,https://play-lh.googleusercontent.com/EGemoI2NTXmTsBVtJqk8jxF9rh8ApRWfsIMQSt2uE4OcpQqbFu7f7NbTK05lx80nuSijCz7sc3a277R67g,"Excellent app - great ""live navigation"" function which allows hiker to continuously check progress on the trail, and if you're still on the trail...the app has saved me a few times when I lost my way at a trail junction. Wish they could incorporate it into a smart watch!",5,3,3.10.0,2020-04-25 04:48:20,,
6f5a28f4-962c-4bd1-ab9c-dab8b8999e12,A Google user,https://play-lh.googleusercontent.com/EGemoI2NTXmTsBVtJqk8jxF9rh8ApRWfsIMQSt2uE4OcpQqbFu7f7NbTK05lx80nuSijCz7sc3a277R67g,"some of the clickology just isnt intuitive. for instance i was trying to favorite certain hikes and it talked about pinning them. so i pinned them and it didnt add the hikes to the favorites (to dos). kind of minor since i figured it out but it seems odd in this day and age to have to figure this out. all that being said, ive enjoyed using this app because its definately helped me find the next place to go in one convienent location. i will continue to use this app!",4,8,3.2.8,2019-01-12 14:47:34,,
7eff4765-704f-4124-9575-055574597dd9,Ronald Goers,https://play-lh.googleusercontent.com/a/ALm5wu0_bnwIPvh-5GCodlIQgJ55IioVIW1cy1oB6U6y=mo,"Wanted to love this app, but when I got to the trail head and launched it, the app needed internet access. Really??? Who backpacks where there's even a phone signal, let alone internet access??? Huge fail!!! Might be a setting or something, but I would expert any such app to default to offline use. Fortunately I also had US Topo Maps loaded on my phone, as well as my trusty Garmin 30x.",3,16,3.12.2,2020-10-20 23:14:43,,
98f95a88-6dab-420d-846e-10a5c76a092d,Megan Murphy,https://play-lh.googleusercontent.com/a-/ACNPEu_z1AE-RoW-hegtGj18VHkMP_rTqC2vIEKEMQiCKNE,"One of the most useful hiking apps I've found, and completely free with no ads! Hats off. 4 stars because while it's an excellent app, it doesn't have all the trails or off-line map downloading (although it does allow you to download and search for trails offline)",4,13,3.13.1,2021-03-08 21:18:01,,
7a8088bd-4a3f-4a80-9868-08a0f7bbc287,Susan and Randy,https://play-lh.googleusercontent.com/a/ALm5wu2fngwe5eCgDVcz5b0YHpfBSjdF-LpuJGmH11S7=mo,"refuses to move data or app onto the sdcard. this renders the app unusable. 3 years later, this is still true. I now have to delete the app because I need another app that has higher priority. Just putting map data on the SD card should be simple and would go a long ways in making this a good app.",1,2,22.10.0,2022-06-11 20:27:41,,
8e1d37e5-1f28-4cf0-bacf-3f43127e00c0,Tom Hirashima,https://play-lh.googleusercontent.com/a-/ACNPEu9mVPoa4wGjrep00GgNHrFcKc3Bi2boSp6pEVucfw,"Great app. Lots of good information about the trails, and I like the fact that you don't need cell signal to use it on the trail. I do wish you could upload photos and add comments to trails from the app, though.",4,2,22.10.0,2022-06-05 17:24:19,,
ec40d317-da73-4aac-aa84-4b8a4195d59b,A Google user,https://play-lh.googleusercontent.com/EGemoI2NTXmTsBVtJqk8jxF9rh8ApRWfsIMQSt2uE4OcpQqbFu7f7NbTK05lx80nuSijCz7sc3a277R67g,"This is my favorite hiking app, but a recent update has left the menu is inaccessible (3 bars at the top left are gone), hiding the app's best features such as the ""gems"" list and filters. Without this, you might as well use Alltrails (a far inferior app). If this issue gets resolved I will update my review to 5 stars.",2,3,3.4.0,2019-09-13 21:20:56,,
1dfdc54a-08bd-440e-a48d-e1bb014e7a90,tharkun,https://play-lh.googleusercontent.com/a/ALm5wu1pm6cmeei6EK1JIhuDE9PYePL-bLrdByFfCbrT=mo,"The ad says ""everything you need, nothing you don't"". That is a lie! It asks you to sign in/create an account to start recording a track. Nobody needs that. Save my track on the device. That needs no account. Make it possible to share or export it. Even that should not require an account but might use one to make some things easier, sure. Uninstalled!",1,5,21.14.0,2021-12-23 04:24:16,,
